<?xml version="1.0" encoding="UTF-8"?>
<!--

    Copyright (C) 2000 - 2026 Silverpeas

    This program is free software: you can redistribute it and/or modify
    it under the terms of the GNU Affero General Public License as
    published by the Free Software Foundation, either version 3 of the
    License, or (at your option) any later version.

    As a special exception to the terms and conditions of version 3.0 of
    the GPL, you may redistribute this Program in connection with Free/Libre
    Open Source Software ("FLOSS") applications as described in Silverpeas's
    FLOSS exception.  You should have received a copy of the text describing
    the FLOSS exception, and it is also available here:
    "https://www.silverpeas.org/legal/floss_exception.html"

    This program is distributed in the hope that it will be useful,
    but WITHOUT ANY WARRANTY; without even the implied warranty of
    MERCHANTABILITY or FITNESS FOR A PARTICULAR PURPOSE.  See the
    GNU Affero General Public License for more details.

    You should have received a copy of the GNU Affero General Public License
    along with this program.  If not, see <https://www.gnu.org/licenses/>.

-->

<migration module="toto"
           xmlns="http://silverpeas.org/xml/ns/migration"
           xmlns:xsi="http://www.w3.org/2001/XMLSchema-instance"
           xsi:schemaLocation="http://silverpeas.org/xml/ns/migration https://www.silverpeas.org/xsd/migration.xsd">

  <current version="004">
    <script name="create_table.sql" type="sql"/>
  </current>

  <upgrade fromVersion="002">
    <script name="update.sql" type="sql"/>
  </upgrade>
  <upgrade fromVersion="003">
    <script name="create_table.sql" type="sql"/>
    <script name="update.groovy" type="groovy"/>
  </upgrade>
</migration>
